<schema-upgrade
    xsi:noNamespaceSchemaLocation="../../main/resources-conf/schema-upgrade.xsd" 
    xmlns:xsi="http://www.w3.org/2001/XMLSchema-instance">
    
  <diff version="6.11">
    <vendor name="mysql">
      <script location="A.sql"/>
      <script location="B.sql"/>
    </vendor>

    <vendor name="mssql">
      <script location="A$.sql"/>
      <script location="B$.sql"/>
    </vendor>
  </diff>

  <diff version="6.12">
    <vendor name="mysql">
      <script location="C.sql"/>
      <script location="D.sql"/>
    </vendor>

    <vendor name="mssql">
      <script location="C$.sql"/>
      <script location="D$.sql"/>
    </vendor>
  </diff>

  <diff version="6.13">
    <vendor name="mysql">
      <script location="E.sql"/>
      <script location="F.sql"/>
    </vendor>

    <vendor name="mssql">
      <script location="E$.sql"/>
      <script location="F$.sql"/>
    </vendor>
  </diff>
</schema-upgrade>